TAIBU Community Health Centre,TAIBU Community Health Centre,TAIBU Community Health Centre,,"27 Tapscott Rd, Unit 1 Toronto, ON M1B 4Y7",Toronto,M1B 4Y7,Call or visit * no referral required * appointments required for some programs,,Primary health care and health promotion programs and services to the black community across the GTA as its priority populationHealth centre focused on family and community health * health professionals assess and treat non-life-threatening injuries or illnesses * referrals to other local health services and personal development groupsCommunity-led health teams develop programs to improve the social supports and conditions that affect long-term health including diabetes education programs and sexual health clinicsPrimary care and health promotion programs for Francophone communities in ScarboroughMental health and addictions outreach programs for Indigenous communities in ScarboroughServices and Programs:Diabetes Education ProgramsSexual Health Clinics,Black community across the Greater Toronto area * all residents of the Malvern neighborhood * Francophone communities in Scarborough * Indigenous mental health and addictions outreach in Scarborough,info@taibuchc.ca,"Mon, Wed, Fri 9am-5pm * Tue, Thu 9am-8pm",English ; French,Administration and Community Programs: 416-644-3539Clinic: 416-644-3536,,,,www.taibuchc.ca,Community Health Centres ~ Black Community ; Family and Community Medicine ~ Black Community ; General Medical Care ~ Black Community ; General Medical Care ~ Francophone Community ; Outreach Programs ~ Indigenous Communities ~ Mental Health Issues ; Outreach Programs ~ Indigenous Communities ~ Substance Use Disorder Issues ; Wellness Programs ~ Black Community ; Wellness Programs ~ Francophone Community,None,LHIN,"12/10/2019, 7:00 PM","6/6/2019, 8:00 PM",Community Health Centres,Fully Accessible,,Community Health Centres,Health Services,TAIBU Community Health Centre,"3/6/2020, 9:51 AM",77,Food & Housing
Concerned Parents of Toronto,Concerned Parents of Toronto,Concerned Parents of Toronto,,"149 Heatherside Dr Toronto, ON M1W 1T6",Toronto,M1W 1T6,No application,,Support group for families of individuals with a dual diagnosis (intellectual disability and mental health needs) * group meets on a regular basis to share information and provide peer support * issues related to systemic advocacy are also discussed and parents have the opportunity to bring forth issues that they would like addressed at a municipal/provincial or federal level * support meetings are held monthly.,Family member who has dual diagnosis,thejohnstons1@sympatico.ca,Mon-Fri 9am-5pm for calls,English,416-492-1468,,,,,Health/Disability Related Support Groups ~ Dual Diagnosis,None,,"11/20/2019, 7:00 PM","4/24/2018, 8:00 PM",Disabilities (Developmental),Fully Accessible,,Disabilities (Developmental),Health Services,Concerned Parents of Toronto,"3/6/2020, 9:51 AM",78,Food & Housing
OOS Medical (Ontario Ostomy Supply Ltd),OOS Medical (Ontario Ostomy Supply Ltd),OOS Medical (Ontario Ostomy Supply Ltd),,"60 Shorting Rd Toronto, ON M1S 3S3",Toronto,M1S 3S3,Call,,"Specialists in ostomy, continence, incontinence and wound care products * OOS Medical carries many brands including Hollister, Coloplast, Convatec, Derma Sciences, Smith & Nephew, Molnlycke, Mentor, Med-RX, Medline, & Bard * Manufacturer of AMICI Intermittent Catheters, AMICI Ileostomy Catheter, SG3 Ostomy Deodorant, Flange Seal Rings, Pouch Liners, Seal N Toss & Protecta Skin Barrier. Customers can also purchase products on-line at OstomyWeb.com.",Anyone,oos@oosmedical.com,Mon-Fri 9am-5pm,English,416-298-8500,Office Manager,,1-800-387-5150,www.oosmedical.com,Incontinence Supplies ; Medical Dressing ; Ostomy Supplies,,,"7/9/2019, 8:00 PM","7/2/2019, 8:00 PM",Health (Specific Conditions),Fully Accessible,,Health (Specific Conditions),Health Services,OOS Medical (Ontario Ostomy Supply Ltd),"3/6/2020, 9:51 AM",79,Food & Housing
Finch Warden Physiotherapy,Finch Warden Physiotherapy,Finch Warden Physiotherapy,,"3420 Finch Ave E Suite 210 Toronto, ON M1W 2R6",Toronto,M1W 2R6,Call or visit,,Physiotherapy and physical rehabilitation centre.,No restrictions,,"Mon, Wed, Fri 10am-7:30pm * Thu 11am-6:30pm",English ; Chinese ; Mandarin ; Cantonese,416-490-7515,"Lois Kwan, Office Manager",,,,Physical Therapy,Fees vary according to services required.,"Health plan, motor vehicle insurance or self payment","10/29/2019, 8:00 PM","10/21/2019, 8:00 PM",Health (General),Fully Accessible,,Health (General),Health Services,Finch Warden Physiotherapy,"3/6/2020, 9:51 AM",87,Food & Housing
TAIBU Community Health Centre,TAIBU Community Health Centre,Sexual Health Clinics,,"27 Tapscott Rd, Unit 1 Toronto, ON M1B 4Y7",Toronto,M1B 4Y7,Call for appointment * no referral required,,Sexual health clinic * health professionals test for and treat sexually transmitted infections * family planning services.birth control counselinglow-cost or free birth controlpregnancy testing and counseling,People who need sexual health services,info@taibuchc.ca,Tue 2:30pm-6:30pm,English ; French,416-644-3536,,,,www.taibuchc.ca,Birth Control Counselling ; Condition Specific Treatment ~ Sexually Transmitted Disease ; Contraception ; Pregnancy Testing ; Pro-Choice Pregnancy Counselling ; Sexual Health Centres ; Sexually Transmitted Disease Screening,Free,LHIN,"12/10/2019, 7:00 PM","6/6/2019, 8:00 PM",Community Health Centres,Fully Accessible,,Community Health Centres,Health Services,TAIBU Community Health Centre,"3/6/2020, 9:51 AM",99,Food & Housing
Sunflower Developmental Services,Sunflower Developmental Services,Sunflower Developmental Services,,"1970 Ellesmere Rd N, Unit 1 Toronto, ON M1H 2W1",Toronto,M1H 2W1,Application required,,"Specializing in life and social skills for people with intellectual disabilities, developmentally delayed and autism.day program for the developmentally delayed to service persons with intellectual and physical disabilities. Day program has a 1 to 4 ratio.Saturday program for the developmentally delayed for persons to engage in leisure activities and community outings to receive assistance in meeting developmental milestone after school program for the developmentally delayed to aid persons with communication, socialization and fine motor skills.senior program for seniors with Alzheimer's, dementia or any other impactive disorder Programs offered include:counselling services for familiesliteracysummer campcommunity outingsrespite and drop-inMarch breakPA daysarts and craftvocational trainingbudgetingfitnessbus route training","All ages * no waiting list, no age gap and no high school diploma required",sunflowerrcs@gmail.com,"Mon-Fri 9am-7pm * After Hours Mon, Fri 3pm-7pm * Sat 10am-3pm",English ; French,416-289-2223,,,,www.sunflowerrcs.com,Adult Out of Home Respite Care ; Children's Out of Home Respite Care ; Developmental Disabilities Day Habilitation Programs ; Extended Child Care ~ Developmental Disabilities ; Health/Disability Related Counselling ~ Developmental Disabilities ; Independent Living Skills Instruction ~ Developmental Disabilities ; Therapeutic Camps ~ Developmental Disabilities ; Vocational Rehabilitation ~ Developmental Disabilities,Dependent on the support required,Private,"3/3/2020, 7:00 PM","2/20/2020, 7:00 PM",Disabilities (Developmental),Fully Accessible,,Disabilities (Developmental),Health Services,Sunflower Developmental Services,"3/6/2020, 9:51 AM",108,Food & Housing
Parkinson's Clinic of Eastern Toronto and Movement Disorders Centre,Parkinson's Clinic of Eastern Toronto and Movement Disorders Centre,Parkinson's Clinic of Eastern Toronto and Movement Disorders Centre,,"2060 Ellesmere Rd, Suite 1-5 Toronto, ON M1H 2V6",Toronto,M1H 2V6,Physician referral required.,,"A Center for Comprehensive and Multidisciplinary Care of Parkinson’s disease, Movement disorders and other Neurological conditions * Patient care services include: Parkinson's clinic, botulinum toxin clinic, movement disorders centre, memory clinic and general neurology clinic * other services include psychiatry, geriatrics, urology, physiotherapy, counselling, speech and swallowing and occupational therapy.",anyone suffering from Parkinson's and other neurological conditions,,Mon-Fri 9am-2pm,"Chinese ; Tamil ; Persian ; English, Urdu, Hindi, Punjabi, Arabic, Saraiki, Sindhi",416-439-2273,,,,www.parkinsonsclinic.ca,Condition Specific Treatment ~ Neurological Impairments ; Condition Specific Treatment ~ Parkinson's Disease,,,"10/15/2019, 8:00 PM","10/9/2019, 8:00 PM",Health (Specific Conditions),Fully Accessible,,Health (Specific Conditions),Health Services,Parkinson's Clinic of Eastern Toronto and Movement Disorders Centre,"3/6/2020, 9:51 AM",109,Food & Housing
Ellesmere Family Health Group,Ellesmere Family Health Group,Walk-in Clinic and Family Practice,,"2100 Ellesmere Rd, Suite 106 Toronto, ON M1H 3B7",Toronto,M1H 3B7,Call or visit * no referral required,,Walk-in medical clinic with associated family practice * doctors and nurses assess and treat minor illnesses and injuries * urgent care * pain management,People who need medical care for minor illnesses and injuries,info@ellesmerefamilyhealth.com,"Mon 8am-7pm * Wed, Thu 8am-5pm * Tue, Fri 8am-6pm * Sat 8am-1pm * Sun 8am-2pm",English,416-690-3533 or 416-690-3450,,,,www.ellesmerefamilyhealth.com,Family and Community Medicine ; General Medical Care ; Pain Management ; Urgent Care Centres ; Walk In Medical Clinics,Most services are covered by OHIP,,"2/3/2020, 7:00 PM","7/28/2019, 8:00 PM",Health (Walk In Clinics),Fully Accessible,,Health (Walk In Clinics),Health Services,Ellesmere Family Health Group,"3/6/2020, 9:51 AM",110,Food & Housing
Community Head Injury Resource Services of Toronto (CHIRS),Aldebrain Residence,Supportive Housing,,"2155 Lawrence Ave E Toronto, ON M1R 5G9",Toronto,M1R 5G9,Adults aged 18 to 60 years with acquired brain injuries are eligible.,,"Aldebrain Residence provides supportive housing to adults with an acquired brain injury. It is a co-ed apartment style residence offering 4-bedroom, 2-bedroom, and independent units, and it has a capacity for 21 adults. Shared units are same sex only. This service is staffed consistently by a team of workers.",Call the intake department to request an application package. A medical report is required.,intake@chirs.com,Daily 24 hours,English,416-757-0527 * CHIRS head office 416-240-8000,"Amoy Jones, Service Coordinator, Aldebrain",,,www.chirs.com,Supportive Housing for People with Disabilities ~ Brain Injuries,Contact intake for current fee schedule,,"12/3/2019, 7:00 PM","11/17/2019, 7:00 PM",Disabilities (Physical),Fully Accessible,,Disabilities (Physical),Health Services,Community Head Injury Resource Services of Toronto (CHIRS). Aldebrain Residence. Supportive Housing,"3/6/2020, 9:51 AM",112,Food & Housing
Participation House,Toronto,Toronto,,"1 Burnview Cres Toronto, ON M1H 1B4",Toronto,M1H 1B4,Referred by Development Services Ontario,,Designated supportive housing with 24-hour on-site personal care and support services to assist adults 18 years and over who have moderate to severe physical and developmental disabilitiesServices and Programs:Burnview Crescent Group HomeCondominium ProgramEaglewing Court Group Home,Must be 18 years and older and receive ODSP funding,information@phtpa.ca,Daily 24 hours * administration: Mon-Fri 9am-5pm,English,416-439-3226,,,,,Supportive Housing for People with Disabilities ~ Multiple Disabilities,Varies per program,Ministy of Community and Social Services * LHIN,"12/3/2019, 7:00 PM","5/13/2018, 8:00 PM",Disabilities (Physical),Fully Accessible,,Disabilities (Physical),Health Services,Participation House. Toronto,"3/6/2020, 9:51 AM",115,Food & Housing
Participation House,Toronto,Burnview Crescent Group Home,,"1 Burnview Cres Toronto, ON M1H 1B4",Toronto,M1H 1B4,Referred by Development Services Ontario,,Group home with 24-hour on-site personal care and support services to assist adults with multiple physical and developmental disabilities aged 18 years and over who are able to direct their own care Services include: assistance with activities of daily livingindividual service and care plansmedication administrationactivation and programming,Must be 18 years and older and receive ODSP funding,information@phtpa.ca,Daily 24 hours,English,416-439-3226,,,,,Supportive Housing for People with Disabilities,XXX,Ministy of Community and Social Services * LHIN,"12/3/2019, 7:00 PM","5/13/2018, 8:00 PM",Disabilities (Physical),Fully Accessible,,Disabilities (Physical),Health Services,Participation House. Toronto. Burnview Crescent Group Home,"3/6/2020, 9:51 AM",120,Food & Housing
Participation House,Toronto - 11753 Sheppard Ave E,Condominium Program,,"11753 Sheppard Ave E Scarborough, ON",Scarborough,,Referred by Centre for Independent Living,,Condominium units with 24-hour on-site personal care and support services to assist adults with multiple physical and developmental disabilities aged 18 years and over who are able to direct their own care Services include: assistance with activities of daily livingindividual service and care plans medication administrationactivation and programming,Must be 18 years and older and receive ODSP funding,information@phtpa.ca,Daily 24 hours,English,416-439-3226,,,,,Supportive Housing for People with Disabilities ~ Multiple Disabilities,XXX,Central East LHIN,"12/3/2019, 7:00 PM","5/13/2018, 8:00 PM",Disabilities (Physical),Fully Accessible,,Disabilities (Physical),Health Services,Participation House. Toronto - 11753 Sheppard Ave E. Condominium Program,"3/6/2020, 9:51 AM",121,Food & Housing
Participation House,Toronto - 14 Eaglewing Crt,Eaglewing Court Group Home,,"14 Eaglewing Court Toronto, ON",Toronto,,Referred by Development Services Ontario,,Group home with 24-hour on-site personal care and support services to assist adults with multiple physical and developmental disabilities aged 18 years and over who are able to direct their own care.  Services include: assistance with activities of daily livingindividual service and care plansmedication administrationactivation and programming,Must be 18 years and older and receive ODSP funding,information@phtpa.ca,Daily 24 hours,English,416-439-3226,,,,,Supportive Housing for People with Disabilities,XXX,Ministy of Community and Social Services * LHIN,"12/3/2019, 7:00 PM","5/13/2018, 8:00 PM",Disabilities (Physical),Fully Accessible,,Disabilities (Physical),Health Services,Participation House. Toronto - 14 Eaglewing Crt. Eaglewing Court Group Home,"3/6/2020, 9:51 AM",122,Food & Housing
Progress Centre Medical - Pharmacy and Clinic,Progress Centre Medical - Pharmacy and Clinic,Progress Centre Medical - Pharmacy and Clinic,,"9 Progress Ave, Unit 1A Toronto, ON M1P 5A4",Toronto,M1P 5A4,Call or visit * no referral required,,Walk-in medical clinic with associated family practice * doctors and nurses assess and treat minor illnesses and injuries * pharmacy on-site,People who need medical care for minor illnesses and injuries,info@progresscentremedical.com,"Mon, Tue, Fri 9am-7pm * Wed, Thu 9am-6pm * Sat-Sun 9am-5pm",English,647-350-6662,"Jerry Leung, Family Doctor; Email: jerry@progresscentremedical.com",jerry@progresscentremedical.com,,www.progresscentremedical.com,General Medical Care ; Walk In Medical Clinics,Most services covered by OHIP,,"2/24/2020, 7:00 PM","8/19/2019, 8:00 PM",Health (Walk In Clinics),Fully Accessible,,Health (Walk In Clinics),Health Services,Progress Centre Medical - Pharmacy and Clinic,"3/6/2020, 9:51 AM",141,Food & Housing
MedCheck Walk-In Clinic,MedCheck Walk-In Clinic,MedCheck Walk-In Clinic,,"1200 Markham Rd, Unit 115 Toronto, ON M1H 3C3",Toronto,M1H 3C3,Visit * no referral required,,Walk-in medical clinic * doctors and nurses assess and treat minor illnesses and injuries,People who need medical care for minor illnesses and injuries,MedCheckClinic@gmail.com,Mon-Fri 10am-9pm * Sat-Sun 11am-3pm,English ; Many other languages,416-289-1212,,,,,Andrology ; General Medical Care ; Geriatric Medicine ; Immunizations ~ Travellers ; Infectious Disease Specialty ; Obstetrics/Gynecology ; Occupational Therapy ; Pediatrics ; Prenatal Care ; Walk In Medical Clinics,Services covered by OHIP,,"12/10/2019, 7:00 PM","10/2/2019, 8:00 PM",Health (Walk In Clinics),Fully Accessible,,Health (Walk In Clinics),Health Services,MedCheck Walk-In Clinic,"3/6/2020, 9:51 AM",146,Food & Housing
Noble Medical Clinic,Noble Medical Clinic,Noble Medical Clinic,,"2934 Eglinton Ave E Toronto, ON M1J 2E4",Toronto,M1J 2E4,Call or visit * no referral required,,Walk-in medical clinic with associated family practice * doctors and nurses assess and treat minor illnesses and injuries Services :flu shotschildren's vaccinesblood collection/lab servicesphysical exams and drivers physicalsprenatal carediabetes counselingPap smearsstitches removaltravel vaccinationPharmacy on-site * lab on-site,People who need medical care for minor illnesses and injuries,pharmacy@noblemedical.ca,Mon-Thu 10am-7pm * Fri 10am-6pm * Sat 10am-3pm,English ; Gujarati ; Hindi ; Tamil ; Urdu,416-667-8488,,,,www.noblemedical.ca,Cancer Detection ~ Cervical Cancer ; Driving Evaluation ; Family and Community Medicine ; General Laboratory Tests ; General Medical Care ; Health/Disability Related Counselling ~ Diabetes ; Immunizations ; Immunizations ~ Travellers ; Prenatal Care ; Walk In Medical Clinics,Most services covered by OHIP,,"2/3/2020, 7:00 PM","1/19/2020, 7:00 PM",Health (Walk In Clinics),Fully Accessible,,Health (Walk In Clinics),Health Services,Noble Medical Clinic,"3/6/2020, 9:51 AM",150,Food & Housing
Town Care Medical and Walk-in Clinic,Town Care Medical and Walk-in Clinic,Town Care Medical and Walk-in Clinic,,"60 Town Centre Court, Unit 3 Toronto, ON M1P 0B1",Toronto,M1P 0B1,Walk-in for clinic * appointments needed for family practice,,Walk-in medical clinic with associated family practice * doctors and nurses assess and treat minor illnesses and injuries,People who need medical care for minor illnesses and injuries,,Mon-Fri 10am-7pm * Sat-Sun 10am-2pm,English ; Arabic ; Chinese (Cantonese) ; Chinese (Mandarin) ; Gujarati ; Hindi ; Spanish ; Urdu ; Persian,416-792-2654,,,,www.townclinic.ca,Family and Community Medicine ; General Medical Care ; Walk In Medical Clinics,Most services covered by OHIP,Private,"12/10/2019, 7:00 PM","10/24/2019, 8:00 PM",Health (Walk In Clinics),Fully Accessible,,Health (Walk In Clinics),Health Services,Town Care Medical and Walk-in Clinic,"3/6/2020, 9:51 AM",151,Food & Housing
The Pines Adult Day Centre,The Pines Adult Day Centre,The Pines Adult Day Centre,,"4130 Lawrence Ave E Scarborough, ON M1E 2R8",Scarborough,M1E 2R8,Call to arrange a site tour and complete application,,"Day program for adults with developmental disabilities * daily activities promote independence and personal success in a group setting fostering socialization and friendship * focus on a social, educational and recreational experience including independent activities for literacy and numeracy, fitness and exercise, social skills, music and dance, arts and crafts, cooking skills and computer skills * outings to swimming, bowling, dance, library, grocery shopping, East Scarborough Storefront Sports Pad and volunteer opportunities with Meals on Wheels and Neighbourhood Newsletter delivery.",Post high school participants with developmental disabilities,pinesdayprogram@gmail.com,Mon-Fri 8:45am-3:15pm,English,416 284-7397,"Monique Pope , Program Coordinator",,,www.pinesdayprogram.ca,Developmental Disabilities Day Habilitation Programs,Call for program fees. Full-time and part-time space available,Eligible clients can apply for Passport Funding,"10/29/2019, 8:00 PM","10/23/2019, 8:00 PM",Disabilities (Developmental),Fully Accessible,,Disabilities (Developmental),Health Services,The Pines Adult Day Centre,"3/6/2020, 9:51 AM",153,Food & Housing
Scarborough Memory Program,Scarborough Memory Program,Alzheimer's Prevention Clinic,,"1371 Neilson Rd Suite 111 Toronto, ON M1B 4Z8",Toronto,M1B 4Z8,physician referral required,,Alzheimer Prevention Clinic specializes in Alzheimer and Dementia care * offers a risk assessment followed by assistance in lifestyle changes * includes counselling and referrals to community services * medical treatment.,"Anyone of any age who believes they are at risk of developing Alzheimer's. They usually are individuals who have a parent with Alzheimer's or have noticed a decline in their own short term memory, because these are common risk factors for developing Alzheimer's",geriatricmedical@rogers.com,Mon-Fri 9am-5pm,English,416-724-8531,,,,,Condition Specific Treatment ~ Dementia ; Dementia Evaluation ; Memory Screening,None,OHIP,"3/5/2019, 7:00 PM","1/7/2019, 7:00 PM",Health (Specific Conditions),Fully Accessible,,Health (Specific Conditions),Health Services,Scarborough Memory Program,"3/6/2020, 9:51 AM",154,Food & Housing
DLC Residential Services,DLC Residential Services,DLC Residential Services,,"18 Skagway Ave, Unit 1A Toronto, ON M1M 3V1",Toronto,M1M 3V1,Call for information on how to apply,,"A community based agency providing residential care and treatment where children and youth with autism spectrum disorder or intellectual and related developmental disabilities can lead dignified and enriching lives with opportunities for growth and friendship.6 group homes in Scarborough and East York * total capacity 29 * focus on communication, behaviour management, life and social skills training, community integration and family inclusion1 transitional group homes for youth 18 and older * capacity 8 Short term care may be available for respite or for assessment of skills","Children, youth and transitional aged youth 6-25 years, with developmental disabilities, autism and dual diagnosis * must be ambulatory * must attend full day program such as school or vocational training",info@dlcrs.com,Mon-Fri 9am-5pm,English,416-281-1147,,,,www.dlcrs.com,Children's Out of Home Respite Care ; Group Homes for Children and Youth with Disabilities ~ Developmental Disabilities ; Group Homes for Children and Youth with Disabilities ~ Dual Diagnosis,Call for current fee schedule,,"8/11/2019, 8:00 PM","7/23/2019, 8:00 PM",Disabilities (Developmental),Not Accessible,,Disabilities (Developmental),Health Services,DLC Residential Services,"3/6/2020, 9:51 AM",155,Food & Housing
Hellenic Hope Centre for Persons with Special Needs,Hellenic Hope Centre for Persons with Special Needs,Adult Day Program,,"3615 Danforth Ave Toronto, ON M1N 2G1",Toronto,M1N 2G1,Self referral,,Provides support and services to people with physical and developmental disabilities and their families:adult day programSaturday respite programrecreational programssocial eveningsparents support group/workshopspeer support group,Persons 21 years and older with physical or developmental disabilities and their families,info@hellenichope.com,Mon-Fri 8:30am-4pm,English ; Greek,416-850-4673,Program Manager,,,www.hellenichope.com,Adult Out of Home Respite Care ; Centres for Independent Living ; Developmental Disabilities Day Habilitation Programs ; Health/Disability Related Support Groups ~ People With Disabilities ; Independent Living Skills Instruction ; Social Clubs/Events ~ People With Disabilities,Monthly fee for day program,Private ; fundraising ; fees,"8/7/2019, 8:00 PM","7/23/2019, 8:00 PM",Disabilities (Developmental),Fully Accessible,,Disabilities (Developmental),Health Services,Hellenic Hope Centre for Persons with Special Needs,"3/6/2020, 9:51 AM",156,Food & Housing
Danforth Medical Centre,Danforth Medical Centre,Danforth Medical Centre,,"880 Danforth Rd Toronto, ON M1K 1H2",Toronto,M1K 1H2,Call or visit - no referral required * appointment required for family practice,,Walk-in medical clinic with associated family practice * doctors and nurses assess and treat minor illnesses and injuries,People who need medical care for minor illnesses and injuries * OHIP card required,,Mon-Fri 9am-6:30pm * Sat-Sun 10am-1pm,English ; Gujarati ; Hindi ; Punjabi ; Urdu,416-264-4848,Dr Gupta,,,,Family and Community Medicine ; General Medical Care ; Walk In Medical Clinics,Most services covered by OHIP,OHIP,"10/29/2019, 8:00 PM","10/21/2019, 8:00 PM",Health (Walk In Clinics),Fully Accessible,,Health (Walk In Clinics),Health Services,Danforth Medical Centre,"3/6/2020, 9:51 AM",157,Food & Housing
West Hill Medical Centre,West Hill Medical Centre,West Hill Medical Centre,,"4637 Kingston Rd, Unit 3 Toronto, ON M1E 2P8",Toronto,M1E 2P8,Call or visit,,Walk-in clinic with associated family practice * on-site laboratory,People who need medical care for minor illnesses and injuries,contact@westhillmedical.ca,Mon-Wed 9am-8pm * Thu-Fri 9am-6pm * Sat 9am-4pm * Sun 10am-3pm,English,416-283-4111,,,,www.westhillmedical.ca,Family and Community Medicine ; General Laboratory Tests ; General Medical Care ; Walk In Medical Clinics,Most services covered by OHIP,,"12/10/2019, 7:00 PM","11/28/2019, 7:00 PM",Health (Walk In Clinics),Fully Accessible,,Health (Walk In Clinics),Health Services,West Hill Medical Centre,"3/6/2020, 9:51 AM",158,Food & Housing
Pediatrics Walk-in Clinic,Pediatrics Walk-in Clinic,Pediatrics Walk-in Clinic,,"222 Dixon Rd, Suite 106 Toronto, ON M9P 3S5",Toronto,M9P 3S5,Call or visit * no referral required,,Children's walk-in medical clinic * doctors and nurses assess and treat minor illnesses and injuries,Children and youth 18 years and younger who need medical care for minor illnesses and injuries,info@dixonwalkinclinic.ca,Mon-Fri 10am-8pm * Sat-Sun 10am-3pm * may stop accepting patients 30 minutes prior to closing,English ; Arabic ; Bulgarian ; Somali ; Spanish,416-850-8947,,,,www.walkinpediatrics.com,Pediatrics ; Walk In Medical Clinics ~ Youth,Most services covered by OHIP,,"11/12/2019, 7:00 PM","10/22/2019, 8:00 PM",Health (Walk In Clinics),Unknown,,Health (Walk In Clinics),Health Services,Pediatrics Walk-in Clinic,"3/6/2020, 9:51 AM",164,Food & Housing
