Pediatrics Walk-in Clinic,Pediatrics Walk-in Clinic,Pediatrics Walk-in Clinic,,"222 Dixon Rd, Suite 106 Toronto, ON M9P 3S5",Toronto,M9P 3S5,Call or visit * no referral required,,Children's walk-in medical clinic * doctors and nurses assess and treat minor illnesses and injuries,Children and youth 18 years and younger who need medical care for minor illnesses and injuries,info@dixonwalkinclinic.ca,Mon-Fri 10am-8pm * Sat-Sun 10am-3pm * may stop accepting patients 30 minutes prior to closing,English ; Arabic ; Bulgarian ; Somali ; Spanish,416-850-8947,,,,www.walkinpediatrics.com,Pediatrics ; Walk In Medical Clinics ~ Youth,Most services covered by OHIP,,"11/12/2019, 7:00 PM","10/22/2019, 8:00 PM",Health (Walk In Clinics),Unknown,,Health (Walk In Clinics),Health Services,Pediatrics Walk-in Clinic,"3/6/2020, 9:51 AM",164,health services
Black Creek Community Health Centre,Sheridan Mall,Sheridan Mall,,"2202 Jane St, Suite 5 Toronto, ON M3M 1A4",Toronto,M3M 1A4,"Call or visit, referrals and appointments required for some programs",,"Health centre focused on family and community health * health professionals assess and treat non-life-threatening injuries or illnesses * referrals to other local health services and personal development groupsCommunity-led health teams develop programs to improve the social supports and conditions that affect long-term healthClinical Dietitian: Nutritional information and education * one-on-one, couple, or family sessions for people with food and health-related concernsMental Health Counseling: One-on-one, couple, and family counseling * mental health screening and assessments * short-term and long-term counseling * confidentialMidwifery Services: Midwives ensure quality Prenatal and Postpartum education and care, and classes to support a healthy pregnancy, labour and birth * Home visits, and Well-Woman and Well-Baby assessments are providedFoot Care Clinic: Chiropodist (foot care specialist) and treats common foot problems * includes basic foot care for both regular and clients living with diabetesHealth Promotion Programs: Programs and services for families, newcomers, youth, adults and older adultsHarm Reduction Program: Support for safer use of substances * one-on-one appointments, drop-in programs, groups, case management support and referrals to services, are provided on an individualized basisPrimary Health Care: Physicians, Nurse Practitioners, Registered Nurses and Registered Practical Nurses provide primary care for individuals and families using a collaborative, team approachPhysiotherapy: Diagnose and manage movement dysfunction and enhance physical and functional abilitiesCare Coordination: People Accessing Care Teams (PACT): People Accessing Care Teams (PACT) PACT brings services to people closer to home * Primary Care Providers refer clients living in North York West and North York Central to a variety of services at Black Creek CHCHealthcare Navigators Services: Healthcare Navigators support people living with chronic health conditions to adhere to a treatment plan by helping to navigate through the healthcare system and coordinate care * helps to address the physical, social and financial barriers to care and liaise between an individual, their family/supporters and their health professional teamBilingual Healthcare Navigators Services: Recognizes the importance of French as an Official Language and provides Healthcare Navigation Services in FrenchServices and Programs:Francophones Language Health Services NavigationSexual Health Clinic",Varies per program,,"Mon, Tue, Wed, Thu 9am-8:30pm * Fri 9am-5pm * Sat 10am-4pm",English,416-249-8000,,,,www.bcchc.com,Childbirth Education ; Community Health Centres ; Family and Community Medicine ; Family Counselling ; General Counselling Services ; General Medical Care ; Marriage Counselling ; Mental Health Evaluation ; Midwifery ; Nutrition Assessment Services ; Nutrition Education ; Personal Health Care Advocate Services ; Physical Therapy ; Podiatry/Foot Care ; Postpartum Care ; Prenatal Care ; Prenatal/Postnatal Home Visitation Programs ; Substance Use Disorder Drop In Programs ; Well Baby Care ; Wellness Programs,some fees for other programs,United Way - United Way Greater Toronto,"3/3/2020, 7:00 PM","2/13/2020, 7:00 PM",Community Health Centres,Fully Accessible,,Community Health Centres,Health Services,Black Creek Community Health Centre. Sheridan Mall,"3/6/2020, 9:51 AM",169,health services
Community Head Injury Resource Services of Toronto (CHIRS),Community Head Injury Resource Services of Toronto (CHIRS),Community Head Injury Resource Services of Toronto (CHIRS),,"62 Finch Ave W Toronto, ON M2N 7G1",Toronto,M2N 7G1,Directly to CHIRS or to the Toronto ABI Network,,"Community-based support and rehabilitation services to adults living with the effects of an acquired brain injury * services include neuropsychological assessment, clinical groups, residential services, outreach and day programs, concurrent disorders groups and specialization - addictions or mental health and acquired brain injuryServices and Programs:Adult Day ServicesAshby Community Support ServicesDrop in Centre","Adults 18-65 years, living with the effects of an acquired brain injury",chirs@chirs.com,Mon-Fri 9am-5pm,English,416-240-8000,,,,www.chirs.com,Attendant Services for People With Disabilities ~ Brain Injuries ; Brain Injury Assessment ; Condition Specific Rehabilitation Services ~ Brain Injuries,Varies per program,,"12/19/2019, 7:00 PM","3/6/2019, 7:00 PM",Disabilities (Physical),Fully Accessible,,Disabilities (Physical),Health Services,Community Head Injury Resource Services of Toronto (CHIRS),"3/6/2020, 9:51 AM",170,health services
Spinal Cord Injury Ontario,Spinal Cord Injury Ontario,Attendant Outreach Services,,"520 Sutherland Dr Toronto, ON M4G 3V9",Toronto,M4G 3V9,Apply through the Project Information Centre(PIC) at the Centre for Independent Living's website: Attendant Services Application,,Delivers non-medical services in the Greater Toronto Area to help in the activities of daily living for people with disabilities,Adults with physical disabilities,info@sciontario.org,Mon-Fri 9am-5pm,English,416-422-5644,"Vera Harris, Senior Manager, Attendant Services; Phone: 416-422-5644 ext 234; Email: vera.harris@sciontario.org",vera.harris@sciontario.org,1-877-422-1112,www.sciontario.org,Attendant Services for People With Disabilities ~ Spinal Cord Injuries,None,,"2/3/2020, 7:00 PM","6/11/2019, 8:00 PM",Health (Specific Conditions),Fully Accessible,,Health (Specific Conditions),Health Services,Spinal Cord Injury Ontario,"3/6/2020, 9:51 AM",172,health services
Christian Horizons Employment Services - Central District Office,Christian Horizons Employment Services - Central District Office,Christian Horizons Employment Services - Central District Office,,"155 Deerhide Cres Toronto, ON M9M 2Z2",Toronto,M9M 2Z2,Call for application information,,"Offers residential, employment and day supports for people with developmental disabilities",Individuals with a developmental disability,mbruce@christian-horizons.org,Mon-Fri 9am-5pm,English,416-630-3646,,,,www.christian-horizons.org,Attendant Services for People With Disabilities ~ Developmental Disabilities ; Vocational Rehabilitation ~ Developmental Disabilities,"Program fees may apply, call for more information",ministry of community and social services,"12/19/2019, 7:00 PM","4/24/2019, 8:00 PM",Disabilities (Developmental),Fully Accessible,,Disabilities (Developmental),Health Services,Christian Horizons Employment Services - Central District Office,"3/6/2020, 9:51 AM",174,health services
Community Association for Riders with Disabilities,Community Association for Riders with Disabilities,Community Association for Riders with Disabilities,,"4777 Dufferin St Toronto, ON M3H 5T3",Toronto,M3H 5T3,Check website for New Riders application form; Family physician must sign medical referral form,,"Offers therapeutic horseback riding for children and adults with disabilities * classes include hippotherapy, psychoeducation, sensory processing, physical rehabilitation and horsemanship",Children and adults that have a disability,info@card.ca,Mon-Fri 9am-5pm,English,416-667-8600,"Seana Waldon, Program Director; Phone: 416-667-8600 ext 6; Email: seana@card.ca",seana@card.ca,,www.card.ca,Equestrian Therapy ~ People With Disabilities,New riders pay $100 for initial physiotherapy assessment,"Minimal government funding, donations, special events","2/3/2020, 7:00 PM","1/1/2020, 7:00 PM",Disabilities (Physical),Fully Accessible,,Disabilities (Physical),Health Services,Community Association for Riders with Disabilities,"3/6/2020, 9:51 AM",175,health services
Occupational Health Clinic for Ontario Workers (OHCOW),Toronto,Medical Diagnostic Services,,"970 Lawrence Ave W, Suite 110 Toronto, ON M6A 3B6",Toronto,M6A 3B6,Medical referral from doctor is required,,"Provides medical assessments and diagnosis by nurses and other health workers for workers who may have a work-related health problems * assessment of work history, health history, working materials and environment","Workers, Employers, health professionals, community groups, members of the general public",toronto@ohcow.on.ca,Mon-Fri 8am-4pm,English,416-449-0009,,,,www.ohcow.on.ca,Occupational Medicine,,,"2/3/2020, 7:00 PM","6/4/2018, 8:00 PM",Health (General),Fully Accessible,,Health (General),Health Services,Occupational Health Clinic for Ontario Workers (OHCOW). Toronto. Medical Diagnostic Services,"3/6/2020, 9:51 AM",180,health services
Hazel Burns Hospice,Hazel Burns Hospice,Hazel Burns Hospice,,"2562 Eglinton Ave W, Suite 203 Toronto, ON M6M 1T4",Toronto,M6M 1T4,Referral required * call for additional information of application,,"Visiting hospice volunteers provide companionship, respite care and emotional support, in-home, to people and their family/caregivers dealing with a life-limiting illness * bereavement support is available on an individual basis or in a group setting for anyone who is experiencing anticipatory grief or the death of a loved one * three massage therapy sessions are offered to the clients and their caregivers","People with a life-limiting illness, who need physical, social and emotional supports",info@hbhospice.com,Mon-Fri 9am-5pm,English,416-782-5915,"Joanne Leake, Social Worker/Case Manager; Email: joann.l@hbhospice.com",joann.l@hbhospice.com,,www.hazelburnshospice.com,Bereavement Counselling ; Bereavement Support Groups ; In Home Hospice Care ; Massage Therapy ~ Terminal Illness ; Palliative Care,Free,Central LHIN,"12/29/2019, 7:00 PM","8/12/2019, 8:00 PM",Health (General),Fully Accessible,,Health (General),Health Services,Hazel Burns Hospice,"3/6/2020, 9:51 AM",181,health services
International Medical Service,International Medical Service,Travel Clinic,,"4000 Leslie St Toronto, ON M2K 2R9",Toronto,M2K 2R9,"Valid provincial or private health insurance required * Bring relevant medical history, immunization records and detailed itinerary",,"Provides health assessments, disease prevention advice and vaccine administration for people that are planning to travel abroad * also provides post-travel health consultations in which any symptoms of illness or allergies can be assessed",No restrictions,info@thetravelclinic.ca,Tue 5pm-7:30pm (Walk-in) Tue 2pm- 4:30pm (by appointment only) Fri 1pm-3:30pm (by appointment only),English ; French,416-494-7512,"Dr. Becky Poanessa, Physician",,,www.thetravelclinic.ca,Immunizations ~ Travellers ; Private Health Care Practices ~ Travellers ; Travel Medicine,"Set fees, call for more information",,"10/1/2019, 8:00 PM","9/26/2019, 8:00 PM",Health (General),Not Accessible,,Health (General),Health Services,International Medical Service,"3/6/2020, 9:51 AM",185,health services
Ontario. Ministry of the Attorney General. Financial Assistance for Families of Homicide Victims Program,Ontario. Ministry of the Attorney General. Financial Assistance for Families of Homicide Victims Program,Ontario. Ministry of the Attorney General. Financial Assistance for Families of Homicide Victims Program,,"Toronto, ON",Toronto,,"For homicides that occur on or after January 1, 2018, applications must be received by February 28, 2019  Application form and guide available on the website * up to 3 applicants can apply on one form (two parents and one spouse, for example) * applicants should provide the CICB file number, if available * basic information on the homicide victim is required * applicants are asked to identify other potential eligible applicants * copy of documents proving relationship to the homicide victim and Ontario residency required * original signed application form must be mailed (electronic or faxed copies not accepted) For homicides that occurred from January 1, 2006 to December 31, 2017 applicants may still be eligible * call to inquire",,"Time limited initiative of the Ontario Government will provide up to $10,000 per homicide to eligible applicants","Homicide (includes first and second degree murder, and manslaughter) must have occurred in Ontario on or after January 1, 2006 * applicant must reside in Ontario and be the victim's parent, or spouse at the time of the homicide * the victim must not have contributed to his or her death through criminal activity or other behaviour that could reasonably have been expected to lead to the homicide * applicant must not have a conviction or any pending charges related to the homicide, and must not have been found to have contributed to the homicide * pain and suffering awards from the Criminal Injuries Compensation Board (CICB) taken into consideration",INFO-FAFHV-VVPD@ontario.ca,Mon-Fri 8:30 am-5 pm,English ; French,416-212-9164,,,1-855-467-4344,www.attorneygeneral.jus.gov.on.ca/english/ovss/financial_assistance_for_families_of_homicide_victims/,Crime Victim Compensation ~ Families/Friends of Murder Victims,,,"3/1/2020, 7:00 PM","4/1/2019, 8:00 PM",Legal (General),Not Applicable,,Legal (General),Law & Government,Ontario. Ministry of the Attorney General. Financial Assistance for Families of Homicide Victims Program,"3/6/2020, 9:51 AM",338,Financial Services
Advocacy Centre for the Elderly,Advocacy Centre for the Elderly,Advocacy Centre for the Elderly,,"2 Carlton St, Suite 701 Toronto, ON M5B 1J3",Toronto,M5B 1J3,Call for information,,"Community legal clinic * representation in cases involving issues of particular importance to seniors, such as long term care, hospital discharge issues, elder abuse, government pensions, income maintenance, retirement home tenancies, mental health and mental capacity issues * assistance in dealing with government bureaucracies * visits to home or care facility if necessary * advocacy * community legal education * speakers * law reform * confidential * funded by Legal Aid Ontario",Persons 60 years and older who meet financial or case eligibility guidelines,,"Legal information and advice -- Mon, Wed, Fri 9 am-5 pm * also open Tue 9 am-5 pm, Thu 1 pm-5 pm",English ; Lithuanian ; interpreters available by appointment for other languages,416-598-2656,,,1-855-598-2656,www.acelaw.ca,Community Legal Clinics ; Elder Law ; Individual Advocacy ~ Older Adults ; Legal Information Services ~ Older Adult/Aging Issues ; Legal Representation ~ Older Adults ; Legislative Advocacy ~ Older Adult/Aging Issues,None,,"2/5/2020, 7:00 PM","1/19/2020, 7:00 PM",Legal (Legal Aid Clinics),Designated parking at entrance - garage entrance from Wood St ; Wheelchair accessible automatic main entrance ; Elevator with braille and voice/tone features ; Barrier-free washroom including door and stall,,Legal (Legal Aid Clinics),Law & Government,Advocacy Centre for the Elderly,"3/6/2020, 9:51 AM",342,Financial Services
ARCH Disability Law Centre,ARCH Disability Law Centre,ARCH Disability Law Centre,,"55 University Ave, 15th Fl Toronto, ON M5J 2H7",Toronto,M5J 2H7,Call to speak with Intake Coordinator and Human Rights Worker,,"Community legal clinic Summary Advice and Referral -- confidential advice and information related to disability issues * telephone service * limited representation in test case litigation * representation for individuals in priority cases * collect calls accepted * public speaking * law reform initiatives * adaptive technology workstations for Internet access, Monday-Friday 10 am-4 pm * electronic newsletter * funded by Legal Aid Ontario",People with disabilities * must meet financial and case eligibility guidelines,archintake@lao.on.ca,"Mon-Fri 9 am-1 pm, 2 pm-5 pm; no intake on Thursdays",English ; American Sign Language (ASL) - (interpreters by appointment) ; interpreters available in other languages by appointment,416-482-8255,Intake Coordinator and Human Rights Worker,,1-866-482-2724,www.archdisabilitylaw.ca,Community Legal Clinics ; Legal Counselling ~ People With Disabilities ; Legal Information Services ~ Disabilities Issues ; Legal Representation ~ People With Disabilities ; Legislative Advocacy ~ Disabilities Issues ; Protection and Advocacy for Individuals with Disabilities ; Public Internet Access Sites ~ People With Disabilities,None,Regional / Municipal - Community Service Partnerships (CSP),"2/5/2020, 7:00 PM","10/24/2019, 8:00 PM",Legal (Legal Aid Clinics),Wheelchair accessible automatic main entrance ; Dedicated accessible washroom with all features ; Elevator with braille features,,Legal (Legal Aid Clinics),Law & Government,ARCH Disability Law Centre,"3/6/2020, 9:51 AM",343,Financial Services
Peacebuilders International (Canada),Peacebuilders International (Canada),Peacebuilders International (Canada),,"Daniels Spectrum 585 Dundas St E, Suite 300 Toronto, ON M5A 2B7",Toronto,M5A 2B7,Call 416-960-9778 for intake appointment,,"Restorative justice programs including prevention, intervention and reintegration * Schools programs * Restorative Youth Circles (RYC) -- diversion from criminal justice system, peer and individual circles * Leaders of Tomorrow Services also at Ontario Court of Justice, 311 Jarvis St, 416-960-9778","Youth in conflict with the justice system * school programs -- youth in conflict at Peacebuilder partner schools, call for details",info@peacebuilders.ca,Call for hours,English,416-960-0105,,,,www.peacebuilders.ca,Juvenile Diversion,,United Way - United Way Greater Toronto,"12/4/2019, 7:00 PM","3/31/2019, 8:00 PM",Legal (General),Wheelchair accessible automatic main entrance ; Easy access to elevator - braille features ; Barrier-free washroom including door and stall ; Braille signage ; Street and lot parking,,Legal (General),Law & Government,Peacebuilders International (Canada),"3/6/2020, 9:51 AM",346,Financial Services
Toronto Drug Treatment Court,Toronto Drug Treatment Court,Toronto Drug Treatment Court,,"Old City Hall 60 Queen St W, Rm 115 Toronto, ON M5H 2M4",Toronto,M5H 2M4,"Forms available at court office, online and Duty Counsel office for application assistance * submit completed forms to court office",,"Problem Solving Court -- voluntary court-supervised outpatient drug addiction treatment with case management * graduates receive a non-custodial sentence rather than incarceration * treatment is provided by the Centre for Addiction and Mental Health (CAMH) at 100 Stokes St, 3rd Fl. * other operating partners include Ontario Court of Justice, Legal Aid Ontario, additional government ministries and community agencies","Non-violent adult offenders who are dependent on cocaine, crack cocaine, heroin or other opiates, or methamphetamine, and have been charged with possession or trafficking of small quantities of crack, cocaine or heroin * may also be charged with minor property crimes or prostitution",,Mon-Fri 8:30 am-4:30 pm,English ; interpreters for other languages,416-973-1314 ; Duty Counsel Office 416-594-9300,,,,www.tdtc.ca,Jail Diversion Programs for Mentally Ill Offenders,,,"12/4/2019, 7:00 PM","12/2/2019, 7:00 PM",Courts,Barrier-free washroom including door and stall ; Wheelchair accessible automatic rear entrance - from Albert St ; Elevator with lowered control panel,,Courts,Law & Government,Toronto Drug Treatment Court,"3/6/2020, 9:51 AM",355,Financial Services
ADR Institute of Ontario,ADR Institute of Ontario,ADR Institute of Ontario,,"234 Eglinton Ave E, Suite 405 Toronto, ON M4P 1K5",Toronto,M4P 1K5,Call or email for information,,Promotes alternative dispute resolution * develops standards for mediation and arbitration * seminars and conferences * searchable database of mediators and arbitrators * affiliate of ADR Institute of Canada,,info@adr-ontario.ca,Mon-Fri 9 am-5 pm,English,416-487-4447,"Mena Sestito, Manager of Membership and Accreditations",,1-844-487-4447,www.adr-ontario.ca,Alternative Dispute Resolution ; Professional Skills Development Support ~ Legal Occupations ; Trade Associations ~ Legal Occupations,,,"12/22/2019, 7:00 PM","4/1/2019, 8:00 PM",Legal (General),"Wheelchair accessible washroom, assistance needed with door ; Powered door at entrance",,Legal (General),Law & Government,ADR Institute of Ontario,"3/6/2020, 9:51 AM",366,Financial Services
Legal Aid Ontario,Toronto North,Family Law Service Centre,Toronto North,"45 Sheppard Ave E, Suite 106 Toronto, ON M2N 5W9",Toronto,M2N 5W9,Call or visit website for information,,Family Law Services -- information * summary advice and help with documents * representation for clients with legal aid certificates No same day service,Eligible clients going to family courts -- call for details,,Mon-Fri 8:30 am-4:30 pm,English ; French,416-730-0936 ext 28,,,,www.legalaid.on.ca,Comprehensive Family Law Services ; Legal Representation ~ Divorce/Custody/Support Issues,,,"1/30/2020, 7:00 PM","8/9/2018, 8:00 PM",Legal (General),Wheelchair accessible building including main entrance,,Legal (General),Law & Government,Legal Aid Ontario. Toronto North. Family Law Service Centre,"3/6/2020, 9:51 AM",396,Financial Services
Ontario. Ministry of the Solicitor General,Scarborough Court,Probation and Parole,Scarborough Court,"1911 Eglinton Ave E, Rm 400 Toronto, ON M1L 4P4",Toronto,M1L 4P4,Not applicable,,Probation and parole office,Ages: 18 year(s) and up,,Mon-Fri 8:30 am-4:30 pm,"English ; French - Interpretation, can be arranged",416-325-0312,,,,www.mcscs.jus.gov.on.ca/english/corr_serv/comm_corr/conditional_sent.html,Adult Parole ; Adult Probation,,,"2/6/2020, 7:00 PM","2/5/2020, 7:00 PM",Correctional Services,Designated parking at entrance ; Wheelchair accessible automatic main entrance ; Barrier-free washroom including door and stall,,Correctional Services,Law & Government,Ontario. Ministry of the Solicitor General. Scarborough Court. Probation and Parole,"3/6/2020, 9:51 AM",403,Financial Services
Ontario. Ministry of the Solicitor General,"Jane Street, Metro North Court",Probation and Parole,"Jane Street, Metro North Court","1000 Finch Ave W Toronto, ON M3J 2V5",Toronto,M3J 2V5,Not applicable,,Probation and parole office,Ages: 18 year(s) and up,,Mon-Fri 8:30 am-5 pm,English ; French,416-314-0184,,,,www.mcscs.jus.gov.on.ca/english/corr_serv/comm_corr/conditional_sent.html,Adult Parole ; Adult Probation,,,"2/6/2020, 7:00 PM","8/18/2019, 8:00 PM",Correctional Services,Designated parking at entrance ; Wheelchair accessible automatic main entrance ; Elevator with braille and voice/tone features ; Barrier-free washroom including door and stall,,Correctional Services,Law & Government,"Ontario. Ministry of the Solicitor General. Jane Street, Metro North Court. Probation and Parole","3/6/2020, 9:51 AM",405,Financial Services
Ontario. Ministry of the Solicitor General,Toronto West Court,Probation and Parole,Toronto West Court,"2201 Finch Ave W, Rm 401 Toronto, ON M9M 2Y9",Toronto,M9M 2Y9,Not applicable,,Probation and parole office,Ages: 18 year(s) and up,,Mon-Fri 8:30 am-4:45 pm,English,416-314-0156,,,,www.mcscs.jus.gov.on.ca/english/corr_serv/comm_corr/conditional_sent.html,Adult Parole ; Adult Probation,,,"2/6/2020, 7:00 PM","8/18/2019, 8:00 PM",Correctional Services,Designated parking at entrance ; Wheelchair accessible automatic main entrance ; Barrier-free washroom including door and stall,,Correctional Services,Law & Government,Ontario. Ministry of the Solicitor General. Toronto West Court. Probation and Parole,"3/6/2020, 9:51 AM",411,Financial Services
Ontario. Ministry of the Solicitor General,Old City Hall,Probation and Parole,Old City Hall,"Old City Hall 60 Queen St W, Rm 371 Toronto, ON M5H 2M4",Toronto,M5H 2M4,Not applicable,,Probation and parole office,Ages: 18 year(s) and up,,Mon-Fri 8:30 am-4:30 pm,English ; French,416-314-9701,,,,www.mcscs.jus.gov.on.ca/english/corr_serv/comm_corr/conditional_sent.html,Adult Parole ; Adult Probation,,,"2/9/2020, 7:00 PM","2/5/2020, 7:00 PM",Correctional Services,Barrier-free washroom including door and stall ; Wheelchair accessible automatic rear entrance - from Albert St; Elevator with lowered control panel,,Correctional Services,Law & Government,Ontario. Ministry of the Solicitor General. Old City Hall. Probation and Parole,"3/6/2020, 9:51 AM",414,Financial Services
"Canada. Correctional Service Canada, Central Ontario District","Canada. Correctional Service Canada, Central Ontario District","Canada. Correctional Service Canada, Central Ontario District",,"338 Keele St Toronto, ON M6P 2K7",Toronto,M6P 2K7,Not applicable,,Administrative office * parole supervision and counselling,Men and women released from federal penitentiaries who are under the authority of the Parole Board of Canada,,Mon-Fri 8:30 am-4:30 pm,English ; French,416-763-7415,,,,www.csc-scc.gc.ca,Adult Parole,,,"2/11/2020, 7:00 PM","2/2/2020, 7:00 PM",Correctional Services,Wheelchair accessible automatic main entrance,,Correctional Services,Law & Government,"Canada. Correctional Service Canada, Central Ontario District","3/6/2020, 9:51 AM",427,Financial Services
